source_code,source_concept_id,source_vocabulary_id,source_code_type,source_code_description,source_code_category_name,source_code_category_code,target_concept_name,target_concept_code,target_concept_id,target_vocabulary_id,target_domain,target_concept_class_id,updated_date,valid_end_date
000000000000066710,2010004374,EHIF service codes,ehif_service,Kiiranalüüs testribaga,Laboratoorsed uuringud,6000,Microbiology procedure,19851009,4057955,SNOMED,Measurement,Procedure,2025-12-18,2099-12-31
000000000000066710,2010004374,EHIF service codes,ehif_service,Kiiranalüüs testribaga,Laboratoorsed uuringud,6000,Rapid immunoassay,708099001,45769446,SNOMED,Observation,Qualifier Value,2025-12-18,2099-12-31
000000000000066711,2010004375,EHIF service codes,ehif_service,Immunofluorestsentsuuring*,Laboratoorsed uuringud,6000,Fluorescent immunoassay,30662005,4148777,SNOMED,Measurement,Procedure,2025-12-18,2099-12-31
000000000000066712,2010004376,EHIF service codes,ehif_service,Immunofluorestsentsuuring valmisslaididel*,Laboratoorsed uuringud,6000,Fluorescent immunoassay,30662005,4148777,SNOMED,Measurement,Procedure,2025-12-18,2099-12-31
000000000000066713,2010004377,EHIF service codes,ehif_service,Biopsiamaterjali immunofluorestsentsuuring*,Laboratoorsed uuringud,6000,Fluorescent immunoassay,30662005,4148777,SNOMED,Measurement,Procedure,2025-12-18,2099-12-31
000000000000066713,2010004377,EHIF service codes,ehif_service,Biopsiamaterjali immunofluorestsentsuuring*,Laboratoorsed uuringud,6000,Evaluation of biopsy specimen,441817003,40480861,SNOMED,Procedure,Procedure,2025-12-18,2099-12-31
000000000000066714,2010004378,EHIF service codes,ehif_service,Immunoblot-uuring*,Laboratoorsed uuringud,6000,Immunoblot assay,37310002,4291344,SNOMED,Procedure,Procedure,2025-12-18,2099-12-31
000000000000066715,2010004379,EHIF service codes,ehif_service,Kompleksne immunoblot-uuring,Laboratoorsed uuringud,6000,Immunoblot assay,37310002,4291344,SNOMED,Procedure,Procedure,2025-12-18,2099-12-31
000000000000066716,2010004380,EHIF service codes,ehif_service,Spetsiifiliste antikehade kompleksne samastamine,Laboratoorsed uuringud,6000,Procedure to identify antibody,121258006,4006851,SNOMED,Measurement,Procedure,2025-12-18,2099-12-31
000000000000066717,2010004381,EHIF service codes,ehif_service,CD34 positiivsete tüvirakkude määramine läbivoolutsütomeetril,Laboratoorsed uuringud,6000,CD34 cells [#/volume] in Specimen,74838-4,44816730,LOINC,Measurement,Lab Test,2025-12-18,2099-12-31
000000000000066718,2010004382,EHIF service codes,ehif_service,Analüüs läbivoolutsütomeetril*,Laboratoorsed uuringud,6000,Flow cytometry,64444005,4276031,SNOMED,Procedure,Procedure,2025-12-18,2099-12-31
000000000000066719,2010004383,EHIF service codes,ehif_service,"HIV1,2 antigeeni ja/või antikehade määramine",Laboratoorsed uuringud,6000,HIV 1+2 Ab+HIV1 p24 Ag [Presence] in Serum or Plasma by Immunoassay,56888-1,40760007,LOINC,Measurement,Lab Test,2025-12-18,2099-12-31
000000000000066720,2010004384,EHIF service codes,ehif_service,Prokaltsitoniini määramine immuunmeetodil,Laboratoorsed uuringud,6000,Procalcitonin [Mass/volume] in Serum or Plasma,33959-8,3046279,LOINC,Measurement,Lab Test,2025-12-18,2099-12-31
000000000000066721,2010004385,EHIF service codes,ehif_service,Prostataspetsiifilise antigeeni määramine,Laboratoorsed uuringud,6000,Prostate specific antigen measurement,63476009,4272032,SNOMED,Measurement,Procedure,2025-12-18,2099-12-31
000000000000066800,2010004386,EHIF service codes,ehif_service,Hematoksüliin-eosiin värvinguga biopsiamaterjali uuring (1 plokk),Laboratoorsed uuringud,6000,Evaluation of biopsy specimen,441817003,40480861,SNOMED,Procedure,Procedure,2025-12-18,2099-12-31
000000000000066800,2010004386,EHIF service codes,ehif_service,Hematoksüliin-eosiin värvinguga biopsiamaterjali uuring (1 plokk),Laboratoorsed uuringud,6000,Hematoxylin and eosin stain method,104210008,4014506,SNOMED,Procedure,Procedure,2025-12-18,2099-12-31
000000000000066801,2010004387,EHIF service codes,ehif_service,Operatsioonipreparaadi väljalõige koos makropreparaadi ja histoloogilise preparaadi kirjeldava diagnoosiga (kuni 3 plokki),Laboratoorsed uuringud,6000,Evaluation of surgical biopsy specimen,442709002,40484883,SNOMED,Procedure,Procedure,2025-12-18,2099-12-31
000000000000066802,2010004388,EHIF service codes,ehif_service,"Histoloogilise preparaadi 1 lisavärving (Giemsa, van Gieson) (1 klaas)",Laboratoorsed uuringud,6000,Histopathology test,252416005,4098214,SNOMED,Measurement,Procedure,2025-12-18,2099-12-31
000000000000066803,2010004389,EHIF service codes,ehif_service,Histoloogiline kiiruuring operatsiooni ajal (1 koetükk),Laboratoorsed uuringud,6000,Evaluation of surgical biopsy specimen,442709002,40484883,SNOMED,Procedure,Procedure,2025-12-18,2099-12-31
000000000000066804,2010004390,EHIF service codes,ehif_service,Immunohistokeemiline või -tsütokeemiline uuring ühel koelõigul või tsütoloogilisel preparaadil (1 klaas),Laboratoorsed uuringud,6000,Immunohistochemistry procedure,117617002,4035726,SNOMED,Measurement,Procedure,2025-12-18,2099-12-31
000000000000066805,2010004391,EHIF service codes,ehif_service,Histo- või tsütokeemiline uuring histoloogilisel koelõigul või tsütoloogilisel preparaadil (1 klaas),Laboratoorsed uuringud,6000,Histopathology test,252416005,4098214,SNOMED,Measurement,Procedure,2025-12-18,2099-12-31
000000000000066806,2010004392,EHIF service codes,ehif_service,In situ hübridiseerimine histoloogilisel või tsütoloogilisel materjalil CISH meetodil (1 klaas),Laboratoorsed uuringud,6000,Histopathology test,252416005,4098214,SNOMED,Measurement,Procedure,2025-12-18,2099-12-31
000000000000066806,2010004392,EHIF service codes,ehif_service,In situ hübridiseerimine histoloogilisel või tsütoloogilisel materjalil CISH meetodil (1 klaas),Laboratoorsed uuringud,6000,Chromogenic in situ hybridization technique,787997001,37312688,SNOMED,Observation,Qualifier Value,2025-12-18,2099-12-31
000000000000066807,2010004393,EHIF service codes,ehif_service,Papanicolaou meetodil tehtud ja skriinija hinnatud günekotsütoloogiline uuring,Laboratoorsed uuringud,6000,Microscopic cytologic examination of smear of specimen from female genital tract prepared using Papanicolaou technique,609040007,43531329,SNOMED,Measurement,Procedure,2025-12-18,2099-12-31
000000000000066808,2010004394,EHIF service codes,ehif_service,Skriinija hinnatud üldtsütoloogiline uuring (kuni 3 klaasi),Laboratoorsed uuringud,6000,Cytologic test,116147009,4023405,SNOMED,Measurement,Procedure,2025-12-18,2099-12-31
000000000000066809,2010004395,EHIF service codes,ehif_service,"Papanicolaou meetodil tehtud, skriinija ja patoloogi hinnatud günekotsütoloogiline uuring",Laboratoorsed uuringud,6000,Microscopic cytologic examination of smear of specimen from female genital tract prepared using Papanicolaou technique,609040007,43531329,SNOMED,Measurement,Procedure,2025-12-18,2099-12-31
000000000000066810,2010004396,EHIF service codes,ehif_service,Patoloogi hinnatud üldtsütoloogiline uuring (kuni 3 klaasi),Laboratoorsed uuringud,6000,Cytologic test,116147009,4023405,SNOMED,Measurement,Procedure,2025-12-18,2099-12-31
000000000000066811,2010004397,EHIF service codes,ehif_service,Papanicolaou meetodil tehtud ja patoloogi hinnatud patoloogiline günekotsütoloogiline uuring,Laboratoorsed uuringud,6000,Microscopic cytologic examination of smear of specimen from female genital tract prepared using Papanicolaou technique,609040007,43531329,SNOMED,Measurement,Procedure,2025-12-18,2099-12-31
000000000000066812,2010004398,EHIF service codes,ehif_service,Tsütoloogiline kiiruuring operatsiooni ajal (1 klaas),Laboratoorsed uuringud,6000,Cytologic test,116147009,4023405,SNOMED,Measurement,Procedure,2025-12-18,2099-12-31
000000000000066813,2010004399,EHIF service codes,ehif_service,Tsütobloki uuring (1 plokk),Laboratoorsed uuringud,6000,Cytologic test,116147009,4023405,SNOMED,Measurement,Procedure,2025-12-18,2099-12-31
000000000000066814,2010004400,EHIF service codes,ehif_service,Lahang histoloogilise uuringuga,Laboratoorsed uuringud,6000,Histopathology test,252416005,4098214,SNOMED,Measurement,Procedure,2025-12-18,2099-12-31
000000000000066814,2010004400,EHIF service codes,ehif_service,Lahang histoloogilise uuringuga,Laboratoorsed uuringud,6000,Autopsy examination,29240004,4162299,SNOMED,Procedure,Procedure,2025-12-18,2099-12-31
000000000000066815,2010004401,EHIF service codes,ehif_service,"Lahang koos histoloogilise uuringu ja erivärvimistega, sh kiiruuringud",Laboratoorsed uuringud,6000,Autopsy examination,29240004,4162299,SNOMED,Procedure,Procedure,2025-12-18,2099-12-31
000000000000066815,2010004401,EHIF service codes,ehif_service,"Lahang koos histoloogilise uuringu ja erivärvimistega, sh kiiruuringud",Laboratoorsed uuringud,6000,Histopathology test,252416005,4098214,SNOMED,Measurement,Procedure,2025-12-18,2099-12-31
000000000000066816,2010004402,EHIF service codes,ehif_service,Loote või surnult sündinu lahang ja histoloogiline uuring,Laboratoorsed uuringud,6000,"Autopsy, gross and microscopic examination, stillborn or newborn",16361008,4039104,SNOMED,Procedure,Procedure,2025-12-18,2099-12-31
000000000000066817,2010004403,EHIF service codes,ehif_service,Operatsioonipreparaadi väljalõige koos makrobloki valmistamise ja histoloogilise preparaadi kirjeldava diagnoosiga (1 plokk),Laboratoorsed uuringud,6000,Evaluation of surgical biopsy specimen,442709002,40484883,SNOMED,Procedure,Procedure,2025-12-18,2099-12-31
000000000000066818,2010004404,EHIF service codes,ehif_service,Neerubiopsia elektronmikroskoopiline uuring,Laboratoorsed uuringud,6000,Microscopy,993811000000105,37397944,SNOMED,Measurement,Observable Entity,2025-12-18,2099-12-31
000000000000066818,2010004404,EHIF service codes,ehif_service,Neerubiopsia elektronmikroskoopiline uuring,Laboratoorsed uuringud,6000,Kidney biopsy,7246002,4217034,SNOMED,Procedure,Procedure,2025-12-18,2099-12-31
000000000000066821,2010004405,EHIF service codes,ehif_service,Vedelikupõhine günekotsütoloogiline uuring HPV/NAT leiu täpsustamiseks,Laboratoorsed uuringud,6000,Liquid based cervical cytology screening,417036008,4220448,SNOMED,Measurement,Procedure,2025-12-18,2099-12-31
000000000000066822,2010004406,EHIF service codes,ehif_service,Vedelikupõhine günekotsütoloogiline uuring (LBC),Laboratoorsed uuringud,6000,Liquid based cervical cytology screening,417036008,4220448,SNOMED,Measurement,Procedure,2025-12-18,2099-12-31
000000000000066823,2010004407,EHIF service codes,ehif_service,Hematoksüliin-eosiin värvinguga pahaloomulisuse diferentseeringuga biopsiamaterjali uuring (1 plokk),Laboratoorsed uuringud,6000,Evaluation of biopsy specimen,441817003,40480861,SNOMED,Procedure,Procedure,2025-12-18,2099-12-31
000000000000066823,2010004407,EHIF service codes,ehif_service,Hematoksüliin-eosiin värvinguga pahaloomulisuse diferentseeringuga biopsiamaterjali uuring (1 plokk),Laboratoorsed uuringud,6000,Hematoxylin and eosin stain method,104210008,4014506,SNOMED,Procedure,Procedure,2025-12-18,2099-12-31
000000000000066837,2010004418,EHIF service codes,ehif_service,HER2 geeni amplifikatsooni määramine SISH meetodil,Laboratoorsed uuringud,6000,Silver enhanced in situ hybridization technique,787998006,37312687,SNOMED,Observation,Qualifier Value,2025-12-18,2099-12-31
000000000000066837,2010004418,EHIF service codes,ehif_service,HER2 geeni amplifikatsooni määramine SISH meetodil,Laboratoorsed uuringud,6000,Human epidermal growth factor receptor 2 gene detection by fluorescence in situ hybridization,434363004,4200764,SNOMED,Measurement,Procedure,2025-12-18,2099-12-31
00000000000006710A,2010004419,EHIF service codes,ehif_service,Bioloogilise Materjali (V.A Veri) Aeroob,Laboratoorsed uuringud,6000,Aerobic microbial culture,117033003,4035113,SNOMED,Measurement,Procedure,2025-12-18,2099-12-31
00000000000006710B,2010004420,EHIF service codes,ehif_service,Bioloogilise Materjali Külv Seentele,Laboratoorsed uuringud,6000,Mycology culture,41170006,4165398,SNOMED,Measurement,Procedure,2025-12-18,2099-12-31
00000000000006716A,2010004425,EHIF service codes,ehif_service,Bioloogilse Materjali Anaeroobne Külv,Laboratoorsed uuringud,6000,Anaerobic microbial culture,117034009,4036044,SNOMED,Measurement,Procedure,2025-12-18,2099-12-31
00000000000006725A,2010004428,EHIF service codes,ehif_service,Haigustekitaja Ravimitundlikkuse Määrami,Laboratoorsed uuringud,6000,Antimicrobial susceptibility test,14788002,4032801,SNOMED,Measurement,Procedure,2025-12-18,2099-12-31
00000000000006725B,2010004429,EHIF service codes,ehif_service,Tundlikkuse Määramine Reservrea Preparaa,Laboratoorsed uuringud,6000,Antimicrobial susceptibility test,14788002,4032801,SNOMED,Measurement,Procedure,2025-12-18,2099-12-31
00000000000006834B,2010004431,EHIF service codes,ehif_service,"Kasvaja-, Aneemia-, Jm. Markerite, Ravim",Laboratoorsed uuringud,6000,Immunology laboratory test,252318005,4098179,SNOMED,Measurement,Procedure,2025-12-18,2099-12-31
00000000000006834C,2010004432,EHIF service codes,ehif_service,"Interleukiinide, Erütropoietiini, Deoksü",Laboratoorsed uuringud,6000,Immunochemiluminescent assay,10268009,4010037,SNOMED,Measurement,Procedure,2025-12-18,2099-12-31
00000000000002502L,2010003230,EHIF service codes,ehif_service,Alumise õõnesveeni filter,Operatsiooniaegsed lisavahendid,2200,Vena cava filter,257409000,4107129,SNOMED,Device,Physical Object,2025-12-18,2099-12-31
00000000000002503L,2010003231,EHIF service codes,ehif_service,Koronaarstent,Operatsiooniaegsed lisavahendid,2200,Coronary artery stent,705643001,45767945,SNOMED,Device,Physical Object,2025-12-18,2099-12-31
00000000000002508L,2010003236,EHIF service codes,ehif_service,"Epikutaanne tsentraalne veenikateeter (G 24, G 27)",Operatsiooniaegsed lisavahendid,2200,Central venous catheter,52124006,4179206,SNOMED,Device,Physical Object,2025-12-18,2099-12-31
00000000000002509L,2010003237,EHIF service codes,ehif_service,Südame püsistimulatsiooni elektrood,Operatsiooniaegsed lisavahendid,2200,,No matching concept,0,None,,,2025-12-18,2099-12-31
00000000000002510L,2010003238,EHIF service codes,ehif_service,Vahend avatud arteriaalse juha endovaskulaarseks sulgemiseks,Operatsiooniaegsed lisavahendid,2200,Patent ductus closure prosthesis,360130004,4232673,SNOMED,Device,Physical Object,2025-12-18,2099-12-31
00000000000002511L,2010003239,EHIF service codes,ehif_service,Südame vatsakest/vatsakesi toetav seade (VAD),Operatsiooniaegsed lisavahendid,2200,Ventricular assist device,360064003,4235043,SNOMED,Device,Physical Object,2025-12-18,2099-12-31
00000000000002512L,2010003240,EHIF service codes,ehif_service,Südamestabilisaatori komplekt,Operatsiooniaegsed lisavahendid,2200,,No matching concept,0,None,,,2025-12-18,2099-12-31
00000000000002513L,2010003241,EHIF service codes,ehif_service,Mehhaaniline südameklapiprotees,Operatsiooniaegsed lisavahendid,2200,Mechanical cardiac valve prosthesis,705991002,45768116,SNOMED,Device,Physical Object,2025-12-18,2099-12-31
00000000000002515L,2010003242,EHIF service codes,ehif_service,Bioloogiline südameklapiprotees,Operatsiooniaegsed lisavahendid,2200,Biologic cardiac valve prosthesis,24290003,4085258,SNOMED,Device,Physical Object,2025-12-18,2099-12-31
00000000000002516L,2010003243,EHIF service codes,ehif_service,Bioloogiline perikardist südameklapiprotees,Operatsiooniaegsed lisavahendid,2200,Biologic cardiac valve prosthesis,24290003,4085258,SNOMED,Device,Physical Object,2025-12-18,2099-12-31
00000000000002517L,2010003244,EHIF service codes,ehif_service,Mehhaanilise südameklapiga liitprotees,Operatsiooniaegsed lisavahendid,2200,,No matching concept,0,None,,,2025-12-18,2099-12-31
00000000000002518L,2010003245,EHIF service codes,ehif_service,Südameklapi tugirõngas,Operatsiooniaegsed lisavahendid,2200,,No matching concept,0,None,,,2025-12-18,2099-12-31
00000000000002519L,2010003246,EHIF service codes,ehif_service,Üleneva aordi Valsalva protees,Operatsiooniaegsed lisavahendid,2200,,No matching concept,0,None,,,2025-12-18,2099-12-31
00000000000002520L,2010003247,EHIF service codes,ehif_service,Südameklapi endovaskulaarne protees; Südame poolkuuklapi endovaskulaarne protees (TAVI),Operatsiooniaegsed lisavahendid,2200,,No matching concept,0,None,,,2025-12-18,2099-12-31
00000000000002521L,2010003248,EHIF service codes,ehif_service,Arütmiate kirurgilise ablatsioonravi seade,Operatsiooniaegsed lisavahendid,2200,,No matching concept,0,None,,,2025-12-18,2099-12-31
00000000000002522L,2010003249,EHIF service codes,ehif_service,Metallsulamist koronaarstent,Operatsiooniaegsed lisavahendid,2200,,No matching concept,0,None,,,2025-12-18,2099-12-31
00000000000002523L,2010003250,EHIF service codes,ehif_service,Ravimkaetud koronaarstent,Operatsiooniaegsed lisavahendid,2200,Drug-eluting coronary artery stent,705637003,45772824,SNOMED,Device,Physical Object,2025-12-18,2099-12-31
00000000000002524L,2010003251,EHIF service codes,ehif_service,Ühekambriline südamestimulaator,Operatsiooniaegsed lisavahendid,2200,,No matching concept,0,None,,,2025-12-18,2099-12-31
00000000000002525L,2010003252,EHIF service codes,ehif_service,Kahekambriline südamestimulaator,Operatsiooniaegsed lisavahendid,2200,,No matching concept,0,None,,,2025-12-18,2099-12-31
00000000000002526L,2010003253,EHIF service codes,ehif_service,Resünkroniseeriv kardioverter-defibrillaator (CRT-D),Operatsiooniaegsed lisavahendid,2200,Cardiac resynchronization therapy implantable defibrillator,704707009,45767328,SNOMED,Device,Physical Object,2025-12-18,2099-12-31
00000000000002527L,2010003254,EHIF service codes,ehif_service,Kahekambriline kardioverter-defibrillaator (DR ICD),Operatsiooniaegsed lisavahendid,2200,Dual-chamber implantable defibrillator,468542000,45771922,SNOMED,Device,Physical Object,2025-12-18,2099-12-31
00000000000002528L,2010003255,EHIF service codes,ehif_service,Ühekambriline kardioverter-defibrillaator (VR ICD),Operatsiooniaegsed lisavahendid,2200,Single-chamber implantable defibrillator,465460004,45771731,SNOMED,Device,Physical Object,2025-12-18,2099-12-31
00000000000002529L,2010003256,EHIF service codes,ehif_service,Resünkroniseeriv kardiostimulaator (CRT-P),Operatsiooniaegsed lisavahendid,2200,Cardiac resynchronization therapy implantable pacemaker,704708004,45767329,SNOMED,Device,Physical Object,2025-12-18,2099-12-31
00000000000002530L,2010003257,EHIF service codes,ehif_service,Resünkroniseeriva kardiostimulaatori (CRT) elektrood,Operatsiooniaegsed lisavahendid,2200,,No matching concept,0,None,,,2025-12-18,2099-12-31
00000000000002531L,2010003258,EHIF service codes,ehif_service,Kardioverter-defibrillaatori (ICD) elektrood,Operatsiooniaegsed lisavahendid,2200,Defibrillator electrode,705938005,45770938,SNOMED,Device,Physical Object,2025-12-18,2099-12-31
00000000000002532L,2010003259,EHIF service codes,ehif_service,Südamestimulaatori elektroodi eemaldamise komplekt,Operatsiooniaegsed lisavahendid,2200,,No matching concept,0,None,,,2025-12-18,2099-12-31
00000000000002533L,2010003260,EHIF service codes,ehif_service,Mitraalklapi perkutaanse plastika vahend (komplekt),Operatsiooniaegsed lisavahendid,2200,,No matching concept,0,None,,,2025-12-18,2099-12-31
00000000000002534L,2010003261,EHIF service codes,ehif_service,Vasaku koja kõrvakese sulgur (komplekt),Operatsiooniaegsed lisavahendid,2200,,No matching concept,0,None,,,2025-12-18,2099-12-31
00000000000002535L,2010003262,EHIF service codes,ehif_service,Pärgarteri stent,Operatsiooniaegsed lisavahendid,2200,Coronary artery stent,705643001,45767945,SNOMED,Device,Physical Object,2025-12-18,2099-12-31
00000000000002536L,2010003263,EHIF service codes,ehif_service,Adenosiin (1 viaal),Operatsiooniaegsed lisavahendid,2200,adenosine,296,1309204,RxNorm,Drug,Ingredient,2025-12-18,2099-12-31
00000000000002537L,2010003264,EHIF service codes,ehif_service,Peaajuarterite embolisatsiooni vältimise seade,Operatsiooniaegsed lisavahendid,2200,,No matching concept,0,None,,,2025-12-18,2099-12-31
00000000000002601L,2010003265,EHIF service codes,ehif_service,Lülisamba distraktor,Operatsiooniaegsed lisavahendid,2200,,No matching concept,0,None,,,2025-12-18,2099-12-31
00000000000002604L,2010003268,EHIF service codes,ehif_service,Implantaatide komplekt keeruka lülisambadeformatsiooni ja kasvaja raviks,Operatsiooniaegsed lisavahendid,2200,,No matching concept,0,None,,,2025-12-18,2099-12-31
00000000000002605L,2010003269,EHIF service codes,ehif_service,"Transpedikulaarsete ja sakraalsete kruvidega ning vastava konstruktsiooniga komplekt komplitseeritud deformiteetide, murdude ja kasvajate raviks",Operatsiooniaegsed lisavahendid,2200,,No matching concept,0,None,,,2025-12-18,2099-12-31
00000000000002606L,2010003270,EHIF service codes,ehif_service,"Transpedikulaarsete kruvide ja vastava konstruktsiooniga komplekt lülisambamurdude, -kasvajate ja -deformatsioonide raviks, lülikeha asendusimplantaat",Operatsiooniaegsed lisavahendid,2200,,No matching concept,0,None,,,2025-12-18,2099-12-31
00000000000002607L,2010003271,EHIF service codes,ehif_service,Lastel jäsemete pikendamisel kasutatav varraste komplekt,Operatsiooniaegsed lisavahendid,2200,,No matching concept,0,None,,,2025-12-18,2099-12-31
00000000000002608L,2010003272,EHIF service codes,ehif_service,Lastel kasutatav elastsete osteosünteesivarraste komplekt,Operatsiooniaegsed lisavahendid,2200,,No matching concept,0,None,,,2025-12-18,2099-12-31
00000000000002609L,2010003273,EHIF service codes,ehif_service,Osteosünteesil ning kõõluse ja sidekoe aparaadi kirurgias kasutatavad resorbeeruvad implantaadid,Operatsiooniaegsed lisavahendid,2200,,No matching concept,0,None,,,2025-12-18,2099-12-31
00000000000002610L,2010003274,EHIF service codes,ehif_service,Plaatosteosünteesi väike komplekt,Operatsiooniaegsed lisavahendid,2200,,No matching concept,0,None,,,2025-12-18,2099-12-31
00000000000002611L,2010003275,EHIF service codes,ehif_service,Plaatosteosünteesi keskmine komplekt,Operatsiooniaegsed lisavahendid,2200,,No matching concept,0,None,,,2025-12-18,2099-12-31
00000000000002612L,2010003276,EHIF service codes,ehif_service,Plaatosteosünteesi suur komplekt,Operatsiooniaegsed lisavahendid,2200,,No matching concept,0,None,,,2025-12-18,2099-12-31
00000000000002615L,2010003279,EHIF service codes,ehif_service,Erivajadustega osteosünteesi implantaadi komplekt,Operatsiooniaegsed lisavahendid,2200,,No matching concept,0,None,,,2025-12-18,2099-12-31
00000000000002616L,2010003280,EHIF service codes,ehif_service,Toruluumurru osteosünteesi ettepuurimata nael,Operatsiooniaegsed lisavahendid,2200,,No matching concept,0,None,,,2025-12-18,2099-12-31
00000000000002617L,2010003281,EHIF service codes,ehif_service,Reieluu dünaamilise kruviga implantaadi (DHS/DCS) komplekt,Operatsiooniaegsed lisavahendid,2200,,No matching concept,0,None,,,2025-12-18,2099-12-31
00000000000002618L,2010003282,EHIF service codes,ehif_service,Reieluukaela mediaalse murru implantaat,Operatsiooniaegsed lisavahendid,2200,,No matching concept,0,None,,,2025-12-18,2099-12-31
00000000000002619L,2010003283,EHIF service codes,ehif_service,Intramedullaarne nael (alates 5 mm),Operatsiooniaegsed lisavahendid,2200,Intramedullary rod,8451008,4223817,SNOMED,Device,Physical Object,2025-12-18,2099-12-31
00000000000002621L,2010003285,EHIF service codes,ehif_service,Intramedullaarne väike nael (kuni 5 mm),Operatsiooniaegsed lisavahendid,2200,Intramedullary rod,8451008,4223817,SNOMED,Device,Physical Object,2025-12-18,2099-12-31
00000000000002628L,2010003292,EHIF service codes,ehif_service,Kirschneri varras,Operatsiooniaegsed lisavahendid,2200,K-wire,257301003,4105206,SNOMED,Device,Physical Object,2025-12-18,2099-12-31
00000000000002629L,2010003293,EHIF service codes,ehif_service,Liigese sideaparaadi või kõõluse asendusimplantaat,Operatsiooniaegsed lisavahendid,2200,,No matching concept,0,None,,,2025-12-18,2099-12-31
00000000000002630L,2010003294,EHIF service codes,ehif_service,Põlveliigese- ja õlaliigesesideme kinnituskruvi,Operatsiooniaegsed lisavahendid,2200,,No matching concept,0,None,,,2025-12-18,2099-12-31
00000000000002634L,2010003298,EHIF service codes,ehif_service,Titaan-minikruvi,Operatsiooniaegsed lisavahendid,2200,,No matching concept,0,None,,,2025-12-18,2099-12-31
00000000000002637L,2010003301,EHIF service codes,ehif_service,Rinnakuvarb (Lorenzi süsteem),Operatsiooniaegsed lisavahendid,2200,,No matching concept,0,None,,,2025-12-18,2099-12-31
00000000000002638L,2010003302,EHIF service codes,ehif_service,Transpedikulaarsete kruvide ja vastava konstruktsiooniga süsteem lülisamba fikseerimiseks,Operatsiooniaegsed lisavahendid,2200,,No matching concept,0,None,,,2025-12-18,2099-12-31
00000000000002639L,2010003303,EHIF service codes,ehif_service,Endoproteesi operatsiooni abilisavahend,Operatsiooniaegsed lisavahendid,2200,,No matching concept,0,None,,,2025-12-18,2099-12-31
00000000000002640L,2010003304,EHIF service codes,ehif_service,Luumurru välisfiksatsiooni süsteem,Operatsiooniaegsed lisavahendid,2200,External fixation system,261200006,4130103,SNOMED,Device,Physical Object,2025-12-18,2099-12-31
00000000000002641L,2010003305,EHIF service codes,ehif_service,Tavaline luukruvi,Operatsiooniaegsed lisavahendid,2200,Bone screw,68183006,4239189,SNOMED,Device,Physical Object,2025-12-18,2099-12-31
00000000000002642L,2010003306,EHIF service codes,ehif_service,Kanüleeritud luukruvi,Operatsiooniaegsed lisavahendid,2200,,No matching concept,0,None,,,2025-12-18,2099-12-31
00000000000002643L,2010003307,EHIF service codes,ehif_service,Titaanplaatosteosünteesi minikomplekt,Operatsiooniaegsed lisavahendid,2200,,No matching concept,0,None,,,2025-12-18,2099-12-31
00000000000002644L,2010003308,EHIF service codes,ehif_service,Kraniofatsiaalse osteosünteesi resorbeeruvate implantaatide komplekt,Operatsiooniaegsed lisavahendid,2200,,No matching concept,0,None,,,2025-12-18,2099-12-31
