source_code,source_concept_id,source_vocabulary_id,source_code_type,source_code_description,source_code_category_name,source_code_category_code,target_concept_name,target_concept_code,target_concept_id,target_vocabulary_id,target_domain,target_concept_class_id,updated_date,valid_end_date
0000000000001E2148,2010004978,EHIF service codes,ehif_service,Lõualuu defektide alloplastiline operatsioon,Operatsioonid,4000,Operation on facial bone,63769003,4273546,SNOMED,Procedure,Procedure,2025-12-18,2099-12-31
0000000000001E2149,2010004979,EHIF service codes,ehif_service,Kaasasündinud huulelõhe plastika,Operatsioonid,4000,Repair of cleft lip,234647001,4120786,SNOMED,Procedure,Procedure,2025-12-18,2099-12-31
0000000000001E2150,2010004980,EHIF service codes,ehif_service,Suulaeplastika,Operatsioonid,4000,Uvulopalatopharyngoplasty,8335001,4307240,SNOMED,Procedure,Procedure,2025-12-18,2099-12-31
0000000000001E2151,2010004981,EHIF service codes,ehif_service,Ülalõualuumurru (Le Fort II-III) osteosüntees,Operatsioonid,4000,,No matching concept,0,None,,,2025-12-18,2099-12-31
0000000000001E2152,2010004982,EHIF service codes,ehif_service,Lõualuu defektide autoplastiline operatsioon,Operatsioonid,4000,Reconstruction of mandible,88366003,4228824,SNOMED,Procedure,Procedure,2025-12-18,2099-12-31
0000000000001E2153,2010004983,EHIF service codes,ehif_service,Alalõualuu liigese anküloosi kirurgiline ravi,Operatsioonid,4000,,No matching concept,0,None,,,2025-12-18,2099-12-31
0000000000001E2154,2010004984,EHIF service codes,ehif_service,Rekonstruktiivne rino-heiloplastika,Operatsioonid,4000,,No matching concept,0,None,,,2025-12-18,2099-12-31
0000000000001E2155,2010004985,EHIF service codes,ehif_service,Lõualuude resektsioon,Operatsioonid,4000,,No matching concept,0,None,,,2025-12-18,2099-12-31
0000000000001E2156,2010004986,EHIF service codes,ehif_service,Mikrogeenia ja progeenia ning lahihambumuse kirurgiline ravi,Operatsioonid,4000,,No matching concept,0,None,,,2025-12-18,2099-12-31
0000000000001E2157,2010004987,EHIF service codes,ehif_service,Mikrognaatia ja prognaatia kirurgiline ravi,Operatsioonid,4000,,No matching concept,0,None,,,2025-12-18,2099-12-31
0000000000001E2158,2010004988,EHIF service codes,ehif_service,Näo- ja lõualuupiirkonna kaasasündinud ja omandatud defektide ravi müokutaanse vaskulariseeritud transplantaadiga,Operatsioonid,4000,,No matching concept,0,None,,,2025-12-18,2099-12-31
0000000000001E2159,2010004989,EHIF service codes,ehif_service,Näonärvi anastomooside moodustamine mikrokirurgilisel teel,Operatsioonid,4000,,No matching concept,0,None,,,2025-12-18,2099-12-31
0000000000001E2160,2010004990,EHIF service codes,ehif_service,Orbitaalhüpertelorismi ravi,Operatsioonid,4000,Correction of hypertelorism,231548001,4333689,SNOMED,Procedure,Procedure,2025-12-18,2099-12-31
0000000000001E2161,2010004991,EHIF service codes,ehif_service,Näokolju kirurgiline ravi koronaarse lõikega,Operatsioonid,4000,,No matching concept,0,None,,,2025-12-18,2099-12-31
0000000000001E2162,2010004992,EHIF service codes,ehif_service,Kraniofatsiaalne resektsioon,Operatsioonid,4000,Craniofacial resection of nasal cavity,713159008,37016988,SNOMED,Procedure,Procedure,2025-12-18,2099-12-31
0000000000001E2164,2010004993,EHIF service codes,ehif_service,Metallosteosünteesimaterjali eemaldamine näo- ja lõualuupiirkonnas,Operatsioonid,4000,,No matching concept,0,None,,,2025-12-18,2099-12-31
0000000000001E2166,2010004994,EHIF service codes,ehif_service,Elementide või breketite kleepimine lõualuumurru fikseerimisel,Operatsioonid,4000,Fixation of mandible,270482007,4155525,SNOMED,Procedure,Procedure,2025-12-18,2099-12-31
0000000000001E2167,2010004995,EHIF service codes,ehif_service,Alalõualuu liigese artrotsentees,Operatsioonid,4000,Arthrocentesis of temporomandibular joint,448199007,40488485,SNOMED,Procedure,Procedure,2025-12-18,2099-12-31
0000000000001E2168,2010004996,EHIF service codes,ehif_service,Alalõualuu liigese artroskoopiline operatsioon,Operatsioonid,4000,Arthroscopy,13714004,4028987,SNOMED,Procedure,Procedure,2025-12-18,2099-12-31
0000000000001E2169,2010004997,EHIF service codes,ehif_service,Alalõualuu liigese artrotoomia-artroplastika,Operatsioonid,4000,Arthrotomy of temporomandibular joint,43578004,4185100,SNOMED,Procedure,Procedure,2025-12-18,2099-12-31
0000000000001E2169,2010004997,EHIF service codes,ehif_service,Alalõualuu liigese artrotoomia-artroplastika,Operatsioonid,4000,Arthroplasty of temporomandibular joint,442117004,40482195,SNOMED,Procedure,Procedure,2025-12-18,2099-12-31
0000000000001E2170,2010004998,EHIF service codes,ehif_service,Alalõualuu liigese endoproteesimine,Operatsioonid,4000,Prosthesis to mandible,178495004,4075574,SNOMED,Procedure,Procedure,2025-12-18,2099-12-31
0000000000001E2172,2010004999,EHIF service codes,ehif_service,Koljupõhimiku ja parafarüngeaalsete kasvajate eemaldamine,Operatsioonid,4000,,No matching concept,0,None,,,2025-12-18,2099-12-31
0000000000001E2178,2010005000,EHIF service codes,ehif_service,Vestibulum’i või suupõhja plastika; Vestibulumi või suupõhja plastika,Operatsioonid,4000,,No matching concept,0,None,,,2025-12-18,2099-12-31
0000000000001E2179,2010005001,EHIF service codes,ehif_service,Orbita rekonstruktsioon,Operatsioonid,4000,,No matching concept,0,None,,,2025-12-18,2099-12-31
0000000000001F2101,2010005002,EHIF service codes,ehif_service,Koronaararterite šunteerimine,Operatsioonid,4000,Coronary artery bypass graft,232717009,4336464,SNOMED,Procedure,Procedure,2025-12-18,2099-12-31
0000000000001F2102,2010005003,EHIF service codes,ehif_service,Ühe südameklapi või südamekasvaja või VAD-seadme paigaldamise operatsioon,Operatsioonid,4000,Open heart surgery,2598006,4094240,SNOMED,Procedure,Procedure,2025-12-18,2099-12-31
0000000000001F2103,2010005004,EHIF service codes,ehif_service,Südameklappide operatsioon,Operatsioonid,4000,Operation on heart valve,73544002,4249161,SNOMED,Procedure,Procedure,2025-12-18,2099-12-31
0000000000001F2104,2010005005,EHIF service codes,ehif_service,Kombineeritud südameoperatsioon,Operatsioonid,4000,Open heart surgery,2598006,4094240,SNOMED,Procedure,Procedure,2025-12-18,2099-12-31
0000000000001F2105,2010005006,EHIF service codes,ehif_service,Operatsioon üleneval aordil või aordikaarel,Operatsioonid,4000,Open heart surgery,2598006,4094240,SNOMED,Procedure,Procedure,2025-12-18,2099-12-31
0000000000001F2106,2010005007,EHIF service codes,ehif_service,Kaasasündinud südamerikke operatsioon ilma kunstliku vereringeta,Operatsioonid,4000,Congenital heart disease,13213009,312723,SNOMED,Condition,Disorder,2025-12-18,2099-12-31
0000000000001F2106,2010005007,EHIF service codes,ehif_service,Kaasasündinud südamerikke operatsioon ilma kunstliku vereringeta,Operatsioonid,4000,Operation on heart,64915003,4275564,SNOMED,Procedure,Procedure,2025-12-18,2099-12-31
0000000000001F2107,2010005008,EHIF service codes,ehif_service,Kaasasündinud südamerikke operatsioon kunstliku vereringega,Operatsioonid,4000,Congenital heart disease,13213009,312723,SNOMED,Condition,Disorder,2025-12-18,2099-12-31
0000000000001F2107,2010005008,EHIF service codes,ehif_service,Kaasasündinud südamerikke operatsioon kunstliku vereringega,Operatsioonid,4000,Open heart surgery,2598006,4094240,SNOMED,Procedure,Procedure,2025-12-18,2099-12-31
0000000000001F2108,2010005009,EHIF service codes,ehif_service,"Surnud doonori südame käitlus siirdamiseks, sealhulgas südame eemaldamine; Surnud doonori südame käitlus siirdamiseks, sh südame eemaldamine",Operatsioonid,4000,,No matching concept,0,None,,,2025-12-18,2099-12-31
0000000000001F2109,2010005010,EHIF service codes,ehif_service,"Operatsioon kõhuaordil aneurüsmi ruptuuri, dissektsiooni või trauma korral",Operatsioonid,4000,,No matching concept,0,None,,,2025-12-18,2099-12-31
0000000000001F2110,2010005011,EHIF service codes,ehif_service,Rekonstruktiivoperatsioon alaneva aordi torakaalsel ja/või torakoabdominaalsel osal,Operatsioonid,4000,,No matching concept,0,None,,,2025-12-18,2099-12-31
0000000000001F2111,2010005012,EHIF service codes,ehif_service,Rekonstruktiivoperatsioon aorto-(bi)femoraalsel või ilio-femoraalsel bypass’il ja nende ühendustel; Rekonstruktiivoperatsioon aorto-(bi)femoraalsel või ilio-femoraalsel bypassil ja nende ühendustel,Operatsioonid,4000,,No matching concept,0,None,,,2025-12-18,2099-12-31
0000000000001F2201,2010005013,EHIF service codes,ehif_service,Aordi aneurüsmi endovaskulaarne proteesimine,Operatsioonid,4000,,No matching concept,0,None,,,2025-12-18,2099-12-31
0000000000001G2102,2010005014,EHIF service codes,ehif_service,Trahhea resektsioon,Operatsioonid,4000,Resection of trachea,40583006,4233625,SNOMED,Procedure,Procedure,2025-12-18,2099-12-31
0000000000001G2103,2010005015,EHIF service codes,ehif_service,VATS mediastiinumi tuumori või tsüsti eemaldamiseks või operatsiooniks söögitorul,Operatsioonid,4000,,No matching concept,0,None,,,2025-12-18,2099-12-31
0000000000001H2101,2010005016,EHIF service codes,ehif_service,Onkoplastiline rinnanäärme operatsioon,Operatsioonid,4000,,No matching concept,0,None,,,2025-12-18,2099-12-31
0000000000001H2102,2010005017,EHIF service codes,ehif_service,Rinnanäärme sektorresektsioon,Operatsioonid,4000,Partial mastectomy,64368001,4275911,SNOMED,Procedure,Procedure,2025-12-18,2099-12-31
0000000000001H2103,2010005018,EHIF service codes,ehif_service,Rinnanäärme sektorresektsioon näärmekoe osalise nihutamisega,Operatsioonid,4000,Partial mastectomy,64368001,4275911,SNOMED,Procedure,Procedure,2025-12-18,2099-12-31
0000000000001H2104,2010005019,EHIF service codes,ehif_service,Rinnanäärme korduv sektorresektsioon (kasvaja lõikepiiril),Operatsioonid,4000,Partial mastectomy,64368001,4275911,SNOMED,Procedure,Procedure,2025-12-18,2099-12-31
0000000000001H2105,2010005020,EHIF service codes,ehif_service,Rinnanäärme eemaldamine,Operatsioonid,4000,Excision of breast,1231734007,37164749,SNOMED,Procedure,Procedure,2025-12-18,2099-12-31
0000000000001H2106,2010005021,EHIF service codes,ehif_service,Rinnanäärme sektorresektsioon lümfisõlmede eemaldamisega,Operatsioonid,4000,Partial mastectomy with axillary lymphadenectomy,35482003,4261671,SNOMED,Procedure,Procedure,2025-12-18,2099-12-31
0000000000001H2107,2010005022,EHIF service codes,ehif_service,Rinnanäärme täielik eemaldamine koos lümfisõlmedega,Operatsioonid,4000,Total mastectomy and axillary dissection,446109005,40486448,SNOMED,Procedure,Procedure,2025-12-18,2099-12-31
0000000000001H2108,2010005023,EHIF service codes,ehif_service,Subkutaanne rinnanäärme eemaldamine,Operatsioonid,4000,,No matching concept,0,None,,,2025-12-18,2099-12-31
0000000000001H2109,2010005024,EHIF service codes,ehif_service,Rinnanäärme valvurlümfisõlme biopsia,Operatsioonid,4000,Biopsy of sentinel lymph node of breast,847671000000109,44808115,SNOMED,Procedure,Procedure,2025-12-18,2099-12-31
0000000000001H2110,2010005025,EHIF service codes,ehif_service,Koeekspandri asetamine või eemaldamine,Operatsioonid,4000,,No matching concept,0,None,,,2025-12-18,2099-12-31
0000000000001H2111,2010005026,EHIF service codes,ehif_service,"Rinnanäärme eemaldamine, plastika ja/või rekonstruktsioon proteesiga",Operatsioonid,4000,Excision of breast,1231734007,37164749,SNOMED,Procedure,Procedure,2025-12-18,2099-12-31
0000000000001H2112,2010005027,EHIF service codes,ehif_service,Rinnaimplantaadi eemaldamine,Operatsioonid,4000,Removal of breast implant,27315000,4099462,SNOMED,Procedure,Procedure,2025-12-18,2099-12-31
0000000000001H2113,2010005028,EHIF service codes,ehif_service,Rinna korrigeerimine rinnavähi ravi järel,Operatsioonid,4000,Mammoplasty,33496007,4140686,SNOMED,Procedure,Procedure,2025-12-18,2099-12-31
0000000000001H2114,2010005029,EHIF service codes,ehif_service,Rinnanäärme reduktsioonplastika,Operatsioonid,4000,Reduction mammoplasty,59214008,4241100,SNOMED,Procedure,Procedure,2025-12-18,2099-12-31
0000000000001H2115,2010005030,EHIF service codes,ehif_service,Rinnanibu rekonstruktsioon,Operatsioonid,4000,Nipple reconstruction,387628008,4308646,SNOMED,Procedure,Procedure,2025-12-18,2099-12-31
0000000000001J2133,2010005031,EHIF service codes,ehif_service,Rippuva kõhunahavoldi plastiline operatsioon,Operatsioonid,4000,,No matching concept,0,None,,,2025-12-18,2099-12-31
0000000000001J2134,2010005032,EHIF service codes,ehif_service,Pankrease siirdamine,Operatsioonid,4000,Transplantation of pancreas,62438007,4266668,SNOMED,Procedure,Procedure,2025-12-18,2099-12-31
0000000000001J2135,2010005033,EHIF service codes,ehif_service,Peritoneaaldialüüsikateetri paigaldamise operatsioon,Operatsioonid,4000,Procedure involving peritoneal dialysis catheter,428118009,4325212,SNOMED,Procedure,Procedure,2025-12-18,2099-12-31
0000000000001J2221,2010005034,EHIF service codes,ehif_service,Perkutaanne endoskoopiline peritoneaaldialüüsikateetri paigaldamise operatsioon,Operatsioonid,4000,Procedure involving peritoneal dialysis catheter,428118009,4325212,SNOMED,Procedure,Procedure,2025-12-18,2099-12-31
0000000000001K2104,2010005035,EHIF service codes,ehif_service,Ureetropeksia (stressinkontinentsi operatsioonid),Operatsioonid,4000,Urethropexy,82087005,4218889,SNOMED,Procedure,Procedure,2025-12-18,2099-12-31
0000000000001K2106,2010005036,EHIF service codes,ehif_service,"Neeru eksploratsioon, sealhulgas drenaažoperatsioon",Operatsioonid,4000,Exploration of kidney,387663003,4301342,SNOMED,Procedure,Procedure,2025-12-18,2099-12-31
0000000000001K2107,2010005037,EHIF service codes,ehif_service,Nefrektoomia,Operatsioonid,4000,Total nephrectomy,175905003,4021108,SNOMED,Procedure,Procedure,2025-12-18,2099-12-31
0000000000001K2108,2010005038,EHIF service codes,ehif_service,Nefrektoomia tuumori tõttu,Operatsioonid,4000,Total nephrectomy,175905003,4021108,SNOMED,Procedure,Procedure,2025-12-18,2099-12-31
0000000000001K2109,2010005039,EHIF service codes,ehif_service,Nefroureeterektoomia,Operatsioonid,4000,Nephroureterectomy,175907006,4022807,SNOMED,Procedure,Procedure,2025-12-18,2099-12-31
0000000000001K2110,2010005040,EHIF service codes,ehif_service,Neeru resektsioon tuumori tõttu,Operatsioonid,4000,Kidney excision,108022006,4027426,SNOMED,Procedure,Procedure,2025-12-18,2099-12-31
0000000000001K2112,2010005041,EHIF service codes,ehif_service,"Neeru resektsioon või rekonstruktsioon, välja arvatud tuumori tõttu",Operatsioonid,4000,Kidney excision,108022006,4027426,SNOMED,Procedure,Procedure,2025-12-18,2099-12-31
0000000000001K2113,2010005042,EHIF service codes,ehif_service,Püeloplastika,Operatsioonid,4000,Pyeloplasty,77100009,4299367,SNOMED,Procedure,Procedure,2025-12-18,2099-12-31
0000000000001K2114,2010005043,EHIF service codes,ehif_service,Rekonstruktiivne operatsioon ureeteril,Operatsioonid,4000,Ureter reconstruction,119988007,4002218,SNOMED,Procedure,Procedure,2025-12-18,2099-12-31
0000000000001K2115,2010005044,EHIF service codes,ehif_service,Ureeterotsüstostoomia,Operatsioonid,4000,Reimplantation of ureter,387701008,4308662,SNOMED,Procedure,Procedure,2025-12-18,2099-12-31
0000000000001K2116,2010005045,EHIF service codes,ehif_service,"Kusepõie eksploratsioon, sealhulgas resektsioon, rekonstruktsioon, tsüstektoomia uriiniderivatsioonita",Operatsioonid,4000,Exploration of urinary bladder,176147007,4023293,SNOMED,Procedure,Procedure,2025-12-18,2099-12-31
0000000000001K2117,2010005046,EHIF service codes,ehif_service,Põie-tupe või põie-soole fistulite likvideerimine,Operatsioonid,4000,Closure of fistula of urinary bladder,63361002,4268632,SNOMED,Procedure,Procedure,2025-12-18,2099-12-31
0000000000001K2118,2010005047,EHIF service codes,ehif_service,Kusepõie transuretraalne resektsioon (TURB),Operatsioonid,4000,Transurethral excision of urinary bladder,287708003,4124166,SNOMED,Procedure,Procedure,2025-12-18,2099-12-31
0000000000001K2119,2010005048,EHIF service codes,ehif_service,Transuretraalne tsüstolitotripsia,Operatsioonid,4000,Cystoscopy and lithotripsy of calculus of bladder using laser,446546004,40488324,SNOMED,Procedure,Procedure,2025-12-18,2099-12-31
0000000000001K2121,2010005049,EHIF service codes,ehif_service,Uriiniderivatsioon tsüstektoomiata,Operatsioonid,4000,Urinary diversion procedure,119560006,4002243,SNOMED,Procedure,Procedure,2025-12-18,2099-12-31
0000000000001K2122,2010005050,EHIF service codes,ehif_service,Tsüstektoomia peensoolejuha urostoomi moodustamisega,Operatsioonid,4000,Construction of cutaneous ureteroileostomy,243775002,4086912,SNOMED,Procedure,Procedure,2025-12-18,2099-12-31
0000000000001K2122,2010005050,EHIF service codes,ehif_service,Tsüstektoomia peensoolejuha urostoomi moodustamisega,Operatsioonid,4000,Excision of urinary bladder,108034003,4029571,SNOMED,Procedure,Procedure,2025-12-18,2099-12-31
0000000000001K2123,2010005051,EHIF service codes,ehif_service,Tsüstektoomia uriinireservuaari moodustamise või põieasendusoperatsiooniga,Operatsioonid,4000,Excision of urinary bladder,108034003,4029571,SNOMED,Procedure,Procedure,2025-12-18,2099-12-31
0000000000001K2123,2010005051,EHIF service codes,ehif_service,Tsüstektoomia uriinireservuaari moodustamise või põieasendusoperatsiooniga,Operatsioonid,4000,Urinary diversion procedure,119560006,4002243,SNOMED,Procedure,Procedure,2025-12-18,2099-12-31
0000000000001K2124,2010005052,EHIF service codes,ehif_service,"Uriiniderivatsiooni tüsistuste korrektsioon, kordusplastika",Operatsioonid,4000,Urinary diversion procedure,119560006,4002243,SNOMED,Procedure,Procedure,2025-12-18,2099-12-31
0000000000001K2125,2010005053,EHIF service codes,ehif_service,Eesnäärme transuretraalne resektsioon (TURP) või enukleatsioon (TUEP) või põiekaela intsisioon (TUIP),Operatsioonid,4000,,No matching concept,0,None,,,2025-12-18,2099-12-31
0000000000001K2126,2010005054,EHIF service codes,ehif_service,Eesnäärme adenomektoomia,Operatsioonid,4000,Transurethral prostatectomy,90199006,4234536,SNOMED,Procedure,Procedure,2025-12-18,2099-12-31
0000000000001K2127,2010005055,EHIF service codes,ehif_service,Radikaalne prostatektoomia,Operatsioonid,4000,Radical prostatectomy,26294005,4096783,SNOMED,Procedure,Procedure,2025-12-18,2099-12-31
0000000000001K2128,2010005056,EHIF service codes,ehif_service,Kusepõie sulgurlihase proteesi või lisamuhvi asetamine,Operatsioonid,4000,,No matching concept,0,None,,,2025-12-18,2099-12-31
0000000000001K2129,2010005057,EHIF service codes,ehif_service,"Ureetra rekonstruktsioon, sealhulgas trauma tõttu",Operatsioonid,4000,Reconstruction of urethra,287762004,4117066,SNOMED,Procedure,Procedure,2025-12-18,2099-12-31
0000000000001K2130,2010005058,EHIF service codes,ehif_service,Optiline uretrotoomia,Operatsioonid,4000,Optical urethrotomy,176355007,4072073,SNOMED,Procedure,Procedure,2025-12-18,2099-12-31
0000000000001K2131,2010005059,EHIF service codes,ehif_service,Uretrektoomia,Operatsioonid,4000,Urethra excision,108039008,4028897,SNOMED,Procedure,Procedure,2025-12-18,2099-12-31
0000000000001K2132,2010005060,EHIF service codes,ehif_service,Perineaalse uretrostoomi rajamine,Operatsioonid,4000,Perineal urethrostomy,176135001,4023288,SNOMED,Procedure,Procedure,2025-12-18,2099-12-31
0000000000001K2133,2010005061,EHIF service codes,ehif_service,Peenise amputatsioon,Operatsioonid,4000,Amputation of penis,80855002,4216997,SNOMED,Procedure,Procedure,2025-12-18,2099-12-31
0000000000001K2134,2010005062,EHIF service codes,ehif_service,Peenise plastika,Operatsioonid,4000,Plastic operation on penis,271413004,4156956,SNOMED,Procedure,Procedure,2025-12-18,2099-12-31
0000000000001K2135,2010005063,EHIF service codes,ehif_service,Peenise proteesimine,Operatsioonid,4000,Prosthesis operation on penis,265610000,4142395,SNOMED,Procedure,Procedure,2025-12-18,2099-12-31
0000000000001K2136,2010005064,EHIF service codes,ehif_service,Munandi eemaldamine koos väädiga kasvaja tõttu,Operatsioonid,4000,Testis excision,120001005,4003224,SNOMED,Procedure,Procedure,2025-12-18,2099-12-31
0000000000001K2137,2010005065,EHIF service codes,ehif_service,Seemnejuha läbitavuse taastamine (vaso-vasostoomia),Operatsioonid,4000,Reversal of vasectomy,176490000,4072179,SNOMED,Procedure,Procedure,2025-12-18,2099-12-31
0000000000001K2138,2010005066,EHIF service codes,ehif_service,Orhiektoomia (ühe- või kahepoolne),Operatsioonid,4000,Testis excision,120001005,4003224,SNOMED,Procedure,Procedure,2025-12-18,2099-12-31
0000000000001K2139,2010005067,EHIF service codes,ehif_service,Pisioperatsioonid välissuguelunditel,Operatsioonid,4000,,No matching concept,0,None,,,2025-12-18,2099-12-31
0000000000001K2140,2010005068,EHIF service codes,ehif_service,Neerusiirdamine,Operatsioonid,4000,Transplant of kidney,70536003,4322471,SNOMED,Procedure,Procedure,2025-12-18,2099-12-31
0000000000001K2141,2010005069,EHIF service codes,ehif_service,Neerutransplantaadi eemaldamine,Operatsioonid,4000,,No matching concept,0,None,,,2025-12-18,2099-12-31
0000000000001K2142,2010005070,EHIF service codes,ehif_service,Neerutransplantaadi revisioon,Operatsioonid,4000,,No matching concept,0,None,,,2025-12-18,2099-12-31
0000000000001K2143,2010005071,EHIF service codes,ehif_service,Surnud doonori neerude käitlus siirdamiseks,Operatsioonid,4000,,No matching concept,0,None,,,2025-12-18,2099-12-31
0000000000001K2202,2010005072,EHIF service codes,ehif_service,Neeru primaarsete ja sekundaarsete tuumorite krüoablatsioon,Operatsioonid,4000,Laparoscopic cryoablation of neoplasm of kidney,839851000000105,44808212,SNOMED,Procedure,Procedure,2025-12-18,2099-12-31
0000000000001K2206,2010005073,EHIF service codes,ehif_service,"Perkutaanne endoskoopiline neeru eksploratsioon, sealhulgas drenaažoperatsioon",Operatsioonid,4000,Exploration of kidney,387663003,4301342,SNOMED,Procedure,Procedure,2025-12-18,2099-12-31
0000000000001K2207,2010005074,EHIF service codes,ehif_service,Perkutaanne endoskoopiline nefrektoomia,Operatsioonid,4000,Total nephrectomy,175905003,4021108,SNOMED,Procedure,Procedure,2025-12-18,2099-12-31
0000000000001K2208,2010005075,EHIF service codes,ehif_service,Perkutaanne endoskoopiline nefrektoomia tuumori tõttu,Operatsioonid,4000,Total nephrectomy,175905003,4021108,SNOMED,Procedure,Procedure,2025-12-18,2099-12-31
0000000000001K2209,2010005076,EHIF service codes,ehif_service,Perkutaanne endoskoopiline nefroureeterektoomia,Operatsioonid,4000,Nephroureterectomy,175907006,4022807,SNOMED,Procedure,Procedure,2025-12-18,2099-12-31
0000000000001K2210,2010005077,EHIF service codes,ehif_service,Perkutaanne endoskoopiline neeru resektsioon tuumori tõttu,Operatsioonid,4000,,No matching concept,0,None,,,2025-12-18,2099-12-31
0000000000001K2211,2010005078,EHIF service codes,ehif_service,"Perkutaanne endoskoopiline neeru resektsioon või rekonstruktsioon, välja arvatud tuumori tõttu",Operatsioonid,4000,,No matching concept,0,None,,,2025-12-18,2099-12-31
0000000000001K2212,2010005079,EHIF service codes,ehif_service,Perkutaanne endoskoopiline nefropeksia,Operatsioonid,4000,Nephropexy,15067008,4035162,SNOMED,Procedure,Procedure,2025-12-18,2099-12-31
0000000000001K2213,2010005080,EHIF service codes,ehif_service,Perkutaanne endoskoopiline püeloplastika,Operatsioonid,4000,Pyeloplasty,77100009,4299367,SNOMED,Procedure,Procedure,2025-12-18,2099-12-31
0000000000001K2214,2010005081,EHIF service codes,ehif_service,Perkutaanne endoskoopiline rekonstruktiivne operatsioon ureeteril,Operatsioonid,4000,,No matching concept,0,None,,,2025-12-18,2099-12-31
0000000000001K2215,2010005082,EHIF service codes,ehif_service,Perkutaanne endoskoopiline ureeterotsüstostoomia,Operatsioonid,4000,Reimplantation of ureter,387701008,4308662,SNOMED,Procedure,Procedure,2025-12-18,2099-12-31
0000000000001K2216,2010005083,EHIF service codes,ehif_service,"Perkutaanne endoskoopiline kusepõie eksploratsioon, sealhulgas resektsioon, rekonstruktsioon, tsüstektoomia uriiniderivatsioonita",Operatsioonid,4000,Exploration of urinary bladder,176147007,4023293,SNOMED,Procedure,Procedure,2025-12-18,2099-12-31
0000000000001K2217,2010005084,EHIF service codes,ehif_service,Perkutaanne endoskoopiline põie-tupe või põie-soole fistulite likvideerimine,Operatsioonid,4000,,No matching concept,0,None,,,2025-12-18,2099-12-31
0000000000001K2220,2010005085,EHIF service codes,ehif_service,Perkutaanne endoskoopiline vaagnaelundite evistseratsioon,Operatsioonid,4000,Pelvic exenteration,52224004,4178736,SNOMED,Procedure,Procedure,2025-12-18,2099-12-31
0000000000001K2221,2010005086,EHIF service codes,ehif_service,Perkutaanne endoskoopiline uriiniderivatsioon tsüstektoomiata,Operatsioonid,4000,,No matching concept,0,None,,,2025-12-18,2099-12-31
0000000000001K2222,2010005087,EHIF service codes,ehif_service,Perkutaanne endoskoopiline tsüstektoomia peensoolejuha urostoomi moodustamisega,Operatsioonid,4000,Excision of urinary bladder,108034003,4029571,SNOMED,Procedure,Procedure,2025-12-18,2099-12-31
0000000000001K2223,2010005088,EHIF service codes,ehif_service,Perkutaanne endoskoopiline tsüstektoomia uriinireservuaari moodustamise või põieasendusoperatsiooniga,Operatsioonid,4000,Excision of urinary bladder,108034003,4029571,SNOMED,Procedure,Procedure,2025-12-18,2099-12-31
0000000000001K2226,2010005089,EHIF service codes,ehif_service,Perkutaanne endoskoopiline eesnäärme adenomektoomia,Operatsioonid,4000,Transurethral prostatectomy,90199006,4234536,SNOMED,Procedure,Procedure,2025-12-18,2099-12-31
0000000000001K2227,2010005090,EHIF service codes,ehif_service,Perkutaanne endoskoopiline radikaalne prostatektoomia,Operatsioonid,4000,Radical prostatectomy,26294005,4096783,SNOMED,Procedure,Procedure,2025-12-18,2099-12-31
0000000000001K2228,2010005091,EHIF service codes,ehif_service,Perkutaanne endoskoopiline elusdoonori neeru eemaldamine siirdamiseks,Operatsioonid,4000,,No matching concept,0,None,,,2025-12-18,2099-12-31
0000000000001K2229,2010005092,EHIF service codes,ehif_service,Perkutaanne endoskoopiline varikotseele operatsioon,Operatsioonid,4000,Operation on varicocele,176498007,4073860,SNOMED,Procedure,Procedure,2025-12-18,2099-12-31
